question,expected_fields
"Do you know mate, how much Oracle spends on SG&A?.",['stock_data.operating_expense_sg&a']
Let me think... Which company has a higher amount of long term debt compared to the number of days it holds inventory for?,"['stock_data.inventories_days_held', 'stock_data.long_term_debt']"
"Like, what percentage of the total operating expenses makes up Salesforce's current stock price?.","['stock_data.operating_expense', 'stock_data.price_close']"
Could you help me to look up the news coverage for Costco compared to other companies?,['news_data_source']
Could you tell me the total return on an Oracle investment in the past 5 years?.,['stock_data.total_return']
"Let's analyze the performance of the index from yesterday. Which sector did better, the Real Estate Sector or the Industrials Sector?.","['market_data.Real_Estate', 'market_data.Industrials']"
Do you know what was Cisco's lowest stock price during the day pal?.,['stock_data.price_intraday_low']
"Which index had a better performance last year, the S&P 500 or the S&P General Industry Classification Real Estate Sector Index?","['market_data.S&P500', 'market_data.Real_Estate']"
What is McDonald's lowest trading price compared to its book value per share on the trading day? ,"['stock_data.bps_book_value_per_share', 'stock_data.price_intraday_low']"
"Oh God, I am not sure. Can you tell me what the federal funds target rate is, please?.",['economic_indicators.fed_funds_rate']
Do you know how UnitedHealth's EPS compares to their R&D expenses?,"['stock_data.eps_trailing_12_month', 'stock_data.research_and_development']"
"I'm not sure, but I can find out for you. Give me a moment to research AMD's current asset to long term debt ratio.","['stock_data.long_term_debt', 'stock_data.assets_short_term']"
Can you tell me which month had the lowest consumer confidence index?,"['external_data_source', 'economic_indicators.consumer_confidence']"
Can you tell me the difference between UnitedHealth's EPS and their R&D?.,"['stock_data.eps_trailing_12_month', 'stock_data.research_and_development']"
"Do you know when was the last ex-dividend date for Berkshire Hathaway? And also, do you have any idea what their EBITDA is?.","['stock_data.date_ex_dividend', 'stock_data.ebitda']"
"Could you help me find information about Microsoft? Right, when is their ex-dividend date and also, what is their enterprise value?.","['stock_data.date_ex_dividend', 'stock_data.enterprise_value']"
"Yeah, I am not sure. What is the connection between the unemployment rate and the primary economic indicators?","['economic_indicators.conf_board_leading_indicators', 'economic_indicators.unemployment_rate']"
"I want to know how the unemployment rate relates to the leading economic indicators, mate.","['economic_indicators.conf_board_leading_indicators', 'economic_indicators.unemployment_rate']"
"Which sector did better yesterday in the S&P 500, consumer staples or financials? I bet you know the answer mate!.","['market_data.Consumer_Staples', 'market_data.Financials']"
"Hey mate, have you heard any juicy gossip about any potential mergers or acquisitions in the future? Tell me all the insider info you know!",['external_data_source']
What's the name of the company that it's legally registered under?.,['stock_data.company_name']
Doesn't everyone know the P/E ratio of Comcast compared to their COGS?,"['stock_data.cogs', 'stock_data.ratio_pe']"
Can you tell me when the damn ex-dividend date is for Intel?.,['stock_data.date_ex_dividend']
Do you want to know which company is getting the most media attention?,['news_data_source']
"Based on recent news, which company has received the most media coverage in the past week?.",['news_data_source']
What is the huge difference between PepsiCo's current assets and their book value per share?,"['stock_data.bps_book_value_per_share', 'stock_data.assets_short_term']"
"Ugh, can someone tell me the damn yield of the USA 10-year Government Benchmark bond and how it's going to impact the S&P General Industry Classification Energy Sector Index?","['market_data.Energy', 'economic_indicators.10Y_ust_yield']"
Which company has a higher amount of long term debt compared to the number of days it holds inventory?.,"['stock_data.inventories_days_held', 'stock_data.long_term_debt']"
"I don't know, can you give me a more specific question? The data warehouse contains a lot of information and I cannot provide keywords without a specific news item in mind.",['news_data_source']
Can you tell me what Salesforce's market value is compared to their current assets?,"['stock_data.assets_short_term', 'stock_data.market_capitalization']"
"I understand, you want to know about the relationship between the unemployment rate and the leading economic indicators, right?.","['economic_indicators.conf_board_leading_indicators', 'economic_indicators.unemployment_rate']"
Can you tell me what type of business Bank of America is in?.,['stock_data.general_industry_classification']
Let's take a look at consumer confidence from December 2022 to January 2023. Did it increase or decrease during that time period?,"['economic_indicators.gdp', 'economic_indicators.consumer_confidence']"
"Can you tell me more about Pfizer's financial performance? Specifically, I am interested in their dividend yield compared to their net sales..","['stock_data.sales_or_revenues', 'stock_data.dividend_yield']"
"I see, you want to know about the S&P General Industry Classification and if the healthcare sector is included in it? Is that right?.",['market_data.Health_Care']
"How does the ISM manufacturing index compare to the non-manufacturing index, you know pal?.","['economic_indicators.ism_mfg', 'economic_indicators.ism_non_mfg']"
"I mean, really, who cares about the total value of General Electric's assets? Do you have nothing better to ask?.",['stock_data.assets_total']
What the hell is going on with the Information Technology sector right now?.,['market_data.IT']
Can you help me identify the sector index that represents the consumer discretionary sector?.,"['market_data.Consumer_Disc', 'market_data.Utilities']"
"I'm curious to know, how does Microsoft's non-operating interest income compare to the number of employees, you know?.","['stock_data.employees', 'stock_data.interest_income_not_banks']"
"Come on, is it not common knowledge that Oracle's total liabilities are?",['stock_data.liabilities_total']
"Which company has a higher operating income and lower inventory days held, Mastercard or Visa?","['stock_data.operating_income', 'stock_data.inventories_days_held']"
"I understand you want to know about Philip Morris. So, how many shares of Philip Morris are currently available for trading?.",['stock_data.common_shares_outstanding']
Do you think that social media or online discussions could potentially influence the stock market in recent times?,['external_data_source']
Could you tell me when the latest ex-dividend date is for Bank of America?.,['stock_data.date_ex_dividend']
"Could you tell me about Home Depot's financial situation? Specifically, how does their debt compare to their cost of goods sold?","['stock_data.liabilities_total', 'stock_data.cogs']"
Can you tell me if Pfizer's market capitalization is higher than its enterprise value?,"['stock_data.enterprise_value', 'stock_data.market_capitalization']"
"I'm not sure, but let me see if I can find any information. Ah, it seems that the stock market has been performing well recently. Would you like me to look into any specific companies or industries?.",['external_data_source']
"I am not sure, actually. Is the Consumer Price Index going up or down?.","['economic_indicators.cpi', 'economic_indicators.cpi']"
"I am not even sure, but I think it was something about the leading economic index in 2016, right?",['economic_indicators.conf_board_leading_indicators']
"I mean, it's pretty obvious, but whatever. What even is the 5-year performance of Home Depot's stock return?.",['stock_data.total_return']
Do you know what the diffusion index for ISM manufacturing is pal?.,['economic_indicators.ism_mfg']
"You're interested in any recent news about Amazon, right?.",['news_data_source']
Could you tell me the difference between Comcast's total interest income and total interest expense?.,['stock_data.interest_income']
"Oh God yeah, I don't know. Err... I am not sure if I can provide any recent news articles on the impact of Brexit on the UK economy..",['news_data_source']
Could you please tell me what the forward 12-month EPS is for Chevron?,['stock_data.eps_forward_12_month']
"Do you know how long Philip Morris holds onto their inventory? Based on their current price and cost of goods sold, I'm curious about the number of days..","['stock_data.inventories_days_held', 'stock_data.price_close']"
"Can you tell me about T-Mobile US' EBITDA and earnings per share in the past 12 months, you know?","['stock_data.eps_trailing_12_month', 'stock_data.ebitda']"
I am interested in the correlation between the S&P General Industry Classification Consumer Discretionary Sector Index and the CPI for all urban items. Can you provide any insights on this?.,"['market_data.Consumer_Disc', 'economic_indicators.cpi']"
I don't care about Nike's non-operating interest income. Why does it matter?.,['stock_data.interest_income_not_banks']
"Hey, do you have any updates on the Disney and Fox merger?",['news_data_source']
Can you tell me the latest news on JPMorgan?.,['news_data_source']
"Oh God I mean, I don't know. Like, how much is Bank of America worth compared to its total liabilities?","['stock_data.market_capitalization', 'stock_data.liabilities_total']"
Can you just tell me how many common shares are outstanding and the total current liabilities for Nike? I don't really care about anything else..,"['stock_data.liabilities_short_term', 'stock_data.common_shares_outstanding']"
Can you explain the impact of ISM Purchasing Managers Index (MFG Survey) on the Information Technology industry?.,"['economic_indicators.ism_mfg', 'market_data.IT']"
"Hey buddy, did you catch the latest news about Nvidia's earnings call?",['news_data_source']
"Let's take a look at social media and see what stocks are trending today, shall we?",['external_data_source']
Is the manufacturing sector in the US expanding or shrinking based on the ISM Purchasing Managers Index?,['economic_indicators.ism_mfg']
I am not sure. Oh God... which news article has the most damn keywords?.,['news_data_source']
"Which sector index has done better, the Materials one or the Consumer Staples one?.","['market_data.Materials', 'market_data.Consumer_Staples']"
"Which sector has been on top lately, finance or information technology?.","['market_data.Financials', 'market_data.IT']"
"Can you tell me mate, what is Nike's EBITDA for the most recent fiscal year?.",['stock_data.ebitda']
Do you know how much Intuit spent on acquiring or producing goods in order to make revenue?.,['stock_data.cogs']
"Could you tell me about Bank of America's financials? Specifically, what is their operating income?.",['stock_data.operating_income']
Let's talk about the impact of CPI on the S&P General Industry Classification Energy Sector Index. Does that sound good to you?,"['market_data.Energy', 'economic_indicators.cpi']"
How much of Apple's current price is used for operating expenses?,"['stock_data.price_close', 'stock_data.operating_expense']"
Are there any potential market rumors or insider trading information that could potentially impact a company's stock price?.,['external_data_source']
"I am not sure about this one, but let's see... Oh here it is, looks like Proctor & Gamble spends a certain amount of their EBITDA on R&D. Do you want to know more details about it?.","['stock_data.research_and_development', 'stock_data.ebitda']"
Can you tell me the ISM non-manufacturing survey index for January 2020?.,['economic_indicators.ism_non_mfg']
"What's the deal with the current yield on the 10-year US Treasury Government Bond? And like, how does it stack up against last month's CPI?","['economic_indicators.10Y_ust_yield', 'economic_indicators.cpi']"
"Yo, does Comcast make more money than the total assets it has?.","['stock_data.operating_income', 'stock_data.assets_total']"
"Hey mate, do you know the current price of Bitcoin?.",['external_data_source']
How much are Cisco's liabilities compared to their earnings per share for the past 12 months?,"['stock_data.liabilities_total', 'stock_data.eps_trailing_12_month']"
"I have no idea, buddy. What's the latest news about Chevron?.",['news_data_source']
Do you think there is anything going on in the world of social media or online discussions that could potentially have an impact on the stock market?,['external_data_source']
Can you tell me about the performance of the S&P financials sector in the past week?,['market_data.Financials']
"Oh gosh I don't know, can you tell me? Home Depot... I am not sure, what are their total liabilities as of the most recent ex-dividend date?.","['stock_data.date_ex_dividend', 'stock_data.liabilities_short_term']"
Can you provide a list of companies that are part of the S&P General Industry Classification Information Technology Sector Index?,['market_data.IT']
"Oh gosh, mmhm... I am not sure. How has the materials sector done compared to the stock market in general?.","['market_data.Materials', 'market_data.S&P500']"
"Is Pfizer worth more in market value than the amount of money it owes, you know?.","['stock_data.enterprise_value', 'stock_data.market_capitalization']"
Can you tell me which company has the highest R&D spending compared to their dividend yield?,"['stock_data.dividend_yield', 'stock_data.research_and_development']"
Can you provide me with information on Oracle's PE ratio compared to its operating income?,"['stock_data.operating_income', 'stock_data.ratio_pe']"
Can you tell me which company is associated with the ticker NFLX?.,['stock_data.company_name']
"Hey buddy, do you have any idea what stocks are popular on social media at this moment?.",['external_data_source']
"I am searching for any current news articles about Coca-Cola, could you find any?.",['news_data_source']
"I see, you are curious about Comcast's financial situation. Well, it seems that they do have a considerable amount of long-term debt.",['stock_data.long_term_debt']
Can you tell me about any news articles that have been published about Home Depot?,['news_data_source']
What is the current stock price of Berkshire Hathaway? And how much are their total operating expenses?.,"['stock_data.price_close', 'stock_data.operating_expense']"
"Oh geez, I am not sure about that one. How does the ISM Nonmanufacturers Survey Index have any impact on the S&P General Industry Classification Health Care Sector Index's performance?.","['market_data.Health_Care', 'economic_indicators.ism_non_mfg']"
Could you tell me about the correlation between Tesla's EPS and their investment in R&D?.,"['stock_data.eps_forward_12_month', 'stock_data.research_and_development']"
"Can you tell me the highest price that PepsiCo's stock has reached in a day, and what is the total value of their current assets?.","['stock_data.price_intraday_high', 'stock_data.assets_short_term']"
Let's talk about the damn composite index. What kind of economic indicators are even included in it?.,['economic_indicators.conf_board_leading_indicators']
How long does Procter & Gamble usually keep their inventory before selling it?.,['stock_data.inventories_days_held']
"Hey pal, could you tell me what the difference is between Verizon's highest price during the day and their COGS?","['stock_data.price_intraday_high', 'stock_data.cogs']"
What is the company name used by Johnson & Johnson buddy?.,['stock_data.company_name']
"Is JPMorgan's net interest income higher than their total current assets, you know?.","['stock_data.assets_short_term', 'stock_data.interest_income']"
Can you tell me the current value of the COMMUNICATIONS SERVICES SECTOR Index?,['market_data.Communications_services']
"Oh gosh I am not sure. Which company has the most news coverage? You know, I am not really keeping track of that kind of stuff.",['news_data_source']
Could you tell me about the federal funds target rate?.,['economic_indicators.fed_funds_rate']
"Can you explain the difference between Comcast's current assets and liabilities, mate?.","['stock_data.liabilities_short_term', 'stock_data.assets_short_term']"
"I'm not familiar with Bank of America, but I can tell you that it operates in the banking industry..",['stock_data.general_industry_classification']
"In 2020, which company was buzzing more in the news, Apple or Tesla?",['news_data_source']
Could you give me a rundown of all the boring news articles about that one company?.,['news_data_source']
Does Home Depot make money from investments that have nothing to do with their regular business operations?.,['stock_data.interest_income_not_banks']
Can you tell me the ratio of employees to trailing earnings for Berkshire Hathaway?,"['stock_data.employees', 'stock_data.eps_trailing_12_month']"
"I'm not sure, but perhaps we can compare GDP to the Leading Economic Indicators to get a better understanding of the overall economic situation. What do you think?","['economic_indicators.gdp', 'economic_indicators.conf_board_leading_indicators']"
"So, mate, I was just wondering which sector did better last year, was it financials or energy? I'm really curious, you know!.","['market_data.Financials', 'market_data.Energy']"
"I'm curious, what have you heard about Salesforce recently?.",['news_data_source']
What's the latest news on Walt Disney?.,['news_data_source']
Can you tell me how much money Oracle makes from interest compared to how much money they owe?.,"['stock_data.interest_income', 'stock_data.liabilities_total']"
Can you tell me about the relationship between Berkshire Hathaway's EBITDA and its dividend payments?.,"['stock_data.ebitda', 'stock_data.date_ex_dividend']"
"Could you tell me the latest updates about Apple? Sure, I can give you the latest news related to Apple, no problem..",['news_data_source']
"Oh God, I mean, it's so obvious, Costco's operating expenses are obviously decreasing, right? Like, come on.",['stock_data.operating_expense']
"I don't know, to be honest. Umm... Berkshire Hathaway's market cap, how does it stack up against other companies in the same industry?.",['stock_data.market_capitalization']
"Oh gosh I am not sure. Which sector has like, a higher index value between Utilities and Industrials?.","['market_data.Utilities', 'market_data.Industrials']"
Is there even a real connection between the unemployment rate and consumer confidence?.,"['economic_indicators.consumer_confidence', 'economic_indicators.unemployment_rate']"
"Could you tell me the net sales or revenue of Salesforce after taking into account any discounts, returns, and allowances?.",['stock_data.sales_or_revenues']
"Yeah, I don't know mate. Like, what's the return index thing for Salesforce over some sort of period?",['stock_data.total_return']
"You know, pal, how does Walmart's market cap relate to their cost of goods sold?","['stock_data.market_capitalization', 'stock_data.cogs']"
Is the manufacturing industry in the US doing better or worse based on the ISM Purchasing Managers Index? .,['economic_indicators.ism_mfg']
Could you tell me about the revenue of Boeing?.,['stock_data.sales_or_revenues']
Could you tell me the damn stock price of Salesforce and the total value of their assets?,"['stock_data.assets_short_term', 'stock_data.price_close']"
Can you tell me the current highest stock price for Bank of America and how does their non-operating interest income factor into their overall earnings?.,"['stock_data.price_intraday_high', 'stock_data.interest_income_not_banks']"
Do you think there might be any rumors or speculations on social media that could potentially affect a company's stock price?.,['external_data_source']
"Oh God yeah, I am not sure. Err... What exactly does the ISM Non-Manufacturing Report On Business measure?.",['economic_indicators.ism_non_mfg']
What the hell is the connection between the GDP Price Index and the Leading Economic Indicators?.,"['economic_indicators.conf_board_leading_indicators', 'economic_indicators.personal_consumption_expenditure']"
"For JPMorgan, Which one do you think is higher, their total assets or book value per share?","['stock_data.bps_book_value_per_share', 'stock_data.assets_total']"
"Can you tell me the damn enterprise value of UnitedHealth, please?.",['stock_data.enterprise_value']
Can you tell me the current value of the S&P 500 Composite?.,['market_data.S&P500']
Oh gosh I don't know. Can you tell me the difference between Bank of America's net interest income and the lowest price today?.,"['stock_data.interest_income', 'stock_data.price_intraday_low']"
"Oh boy, I don't know. According to fool.com, Chevron's stock price is, uh, I don't know, I can't even think about it right now.",['external_data_source']
Can you tell me the difference between the lowest share price of Exxon Mobil today and how much it costs to produce goods mate?.,"['stock_data.price_intraday_low', 'stock_data.cogs']"
Can you tell me how the S&P Health Care Sector has been doing?,['market_data.Health_Care']
Can Philip Morris cover its long-term debt with its current assets?.,"['stock_data.assets_short_term', 'stock_data.long_term_debt']"
Uh... I don't know man. When was the last time Walt Disney paid out dividends and what is the value of their shares in the book?,"['stock_data.date_ex_dividend', 'stock_data.bps_book_value_per_share']"
"You want to know about Nike's ticker symbol and dividend yield? Okay, let me see, Nike's ticker symbol is NKE and their current dividend yield is 0.93%. Is that what you were looking for?.","['stock_data.ticker_symbol', 'stock_data.dividend_yield']"
"Everybody knows the stock symbol for Walt Disney is like, DIS. Right?.",['stock_data.ticker_symbol']
Could you tell me the net interest income of Exxon Mobil? I think everyone should know this..,['stock_data.interest_income']
"I mean come on, it's not rocket science. Everyone knows that the utilities sector had a performance in the S&P 500 yesterday..",['market_data.Utilities']
Have you seen any recent news articles about Tesla?.,['news_data_source']
"Let's see, i'm wondering if Coca-Cola's total current assets are more than their total liabilities, do you know?.","['stock_data.liabilities_total', 'stock_data.assets_short_term']"
Let's compare the Communication Services and Consumer Discretionary sectors. Which one do you think is more conscientious?,"['market_data.Communications_services', 'market_data.Consumer_Disc']"
"Last week, did the utilities sector outperform the real estate sector?.","['market_data.Real_Estate', 'market_data.Utilities']"
"Can you tell me how Pfizer's total return index compares to its 12-month trailing EPS, mate?","['stock_data.eps_trailing_12_month', 'stock_data.total_return']"
Could you tell me about the current updates on the stock market?,['external_data_source']
"Ugh, I am so over people asking about Apple all the time. But fine, let me just tell you the damn latest news.",['news_data_source']
"Hey buddy, can you tell me the current price of the COMMUNICATIONS SERVICES SECTOR Index?.",['market_data.Communications_services']
Could you tell me about the latest news regarding Apple in the past week? I am looking for the top three stories..,['news_data_source']
"Yo, what's the deal with the current unemployment rate in the US, according to the Bureau of Labor Statistics?",['economic_indicators.unemployment_rate']
Could you tell me if Philip Morris is making a negative or positive operating income?.,['stock_data.operating_income']
"Huh, I am not sure, I mean, JNJ's price to earning ratio, how does it compare to the cost of goods sold, I don't know, I don't know about that stuff.","['stock_data.ratio_pe', 'stock_data.cogs']"
"So, you are asking about the news article with the highest number of keywords, right? Okay, let me check that for you.",['news_data_source']
Is Salesforce making a profit? Is it operating at a loss?.,['stock_data.operating_income']
"Hey buddy, could you tell me the R&D to SG&A expense ratio for T-Mobile?.","['stock_data.research_and_development', 'stock_data.operating_expense_sg&a']"
What even are the S&P 500 Consumer Discretionary Sector Index and the S&P 500 Health Care Sector Index?,"['market_data.Consumer_Disc', 'market_data.Health_Care']"
"I don't really know, sorry. Mmhm... How much has the consumer price index for personal spending been changing in the United States?",['economic_indicators.personal_consumption_expenditure']
"Does Exxon Mobil, like, spend a lot on R&D? Wait, do they even have a lot of assets?","['stock_data.research_and_development', 'stock_data.assets_total']"
"I have no idea. Ugh, let me see... which company was talked about the most in the past week?.",['news_data_source']
"Oh gosh, I am really not sure. I mean, I am not really good with numbers, but I know Amazon has a pretty high inventory count compared to their current price?","['stock_data.inventories_days_held', 'stock_data.price_close']"
Can you update me on the current events in the oil industry?,['news_data_source']
"Seriously, why are you even asking about this? The total return index of Bank of America is irrelevant and not worth discussing. Focus on something more important..",['stock_data.total_return']
Which damn company has a higher intraday low and a lower P/E ratio?.,"['stock_data.price_intraday_low', 'stock_data.eps_trailing_12_month']"
"Can you tell me more about the composite index? Specifically, what economic indicators are taken into consideration?.",['economic_indicators.conf_board_leading_indicators']
